{
  "id": "b2c3d4e5-f6a7-8901-bcde-f12345678901",
  "displayName": "Alex",
  "avatarName": "alex",
  "language": "en",
  "currentLevel": 2,
  "strengths": ["governing_thought", "governing_thought_position", "single_idea_per_block", "clarity"],
  "developmentAreas": ["mece_grouping", "deductive_ordering"],
  "sessionsCompleted": 25,
  "lastSessionDate": "2026-03-06",
  "streakDays": 11,
  "recentScores": [
    { "sessionType": "say_it_clearly", "totalScore": 7, "date": "2026-03-06" },
    { "sessionType": "say_it_clearly", "totalScore": 8, "date": "2026-03-05" },
    { "sessionType": "find_the_point", "totalScore": 6, "date": "2026-03-04" },
    { "sessionType": "say_it_clearly", "totalScore": 9, "date": "2026-03-03" },
    { "sessionType": "say_it_clearly", "totalScore": 8, "date": "2026-03-02" }
  ],
  "notes": "Ready for MECE challenges. Strong on foundations. Tends to list rather than group."
}
