{
  "id": "a1b2c3d4-e5f6-7890-abcd-ef1234567890",
  "displayName": "Maxi",
  "avatarName": "maxi",
  "language": "de",
  "currentLevel": 1,
  "strengths": [],
  "developmentAreas": ["governing_thought", "governing_thought_position", "clarity"],
  "sessionsCompleted": 0,
  "streakDays": 0,
  "recentScores": [],
  "notes": ""
}
