{
  "id": "b2c3d4e5-f6a7-8901-bcde-f12345678901",
  "displayName": "Alex",
  "avatarName": "alex",
  "language": "en",
  "currentLevel": 2,
  "strengths": ["governing_thought", "governing_thought_position", "single_idea_per_block", "clarity", "redundancy_avoidance", "mece_grouping", "deductive_ordering"],
  "developmentAreas": ["scq_framing", "horizontal_logic"],
  "sessionsCompleted": 48,
  "lastSessionDate": "2026-03-06",
  "streakDays": 22,
  "recentScores": [
    { "sessionType": "say_it_clearly", "totalScore": 11, "date": "2026-03-06" },
    { "sessionType": "find_the_point", "totalScore": 10, "date": "2026-03-05" },
    { "sessionType": "say_it_clearly", "totalScore": 12, "date": "2026-03-04" },
    { "sessionType": "fix_this_mess", "totalScore": 9, "date": "2026-03-03" },
    { "sessionType": "say_it_clearly", "totalScore": 11, "date": "2026-03-02" }
  ],
  "notes": "Approaching L3 readiness. MECE is strong. Needs work on framing complex arguments with SCQ."
}
